"category","source","count","channels","example_title","example_url"
"地方政府/地方主管部门","中共三亚市委","2","hot","海南三亚：积极发展海洋能、地热能、氢能等新能源","https://www.ditan.com/news/hot/5466.html"
"协会/联盟/研究机构","中国核能行业协会","2","interview","张克俭：我国建立了完备科学有效的核安全治理体系","https://www.ditan.com/news/interview/3651.html"
"央国企/能源集团/电网","中国华电集团有限公司","2","hot","中国华电20万千瓦新能源制氢示范项目投产","https://www.ditan.com/news/hot/1691.html"
"其他/待人工判断","中国绿色时报","2","hot","北京城市副中心首笔园林碳票成功签发上市","https://www.ditan.com/news/hot/9335.html"
"央国企/能源集团/电网","中国能建","2","hot","国内首台褐煤百万机组首次并网成功","https://www.ditan.com/news/hot/8312.html"
"其他/待人工判断","中国人大网","2","hot","国务院：应对气候变化和碳达峰碳中和工作情况的报告","https://www.ditan.com/news/hot/8426.html"
"央国企/能源集团/电网","中国石油新闻中心","2","hot","大庆油田发布我国首个采油设备领域国际标准","https://www.ditan.com/news/hot/4322.html"
"央国企/能源集团/电网","中核智库","2","hot","韩国颁发自2016年以来的首份核电建设许可证","https://www.ditan.com/news/hot/5425.html"
"中央部委/国务院/监管","中华人民共和国国家发展和改革委员会","2","hot","国家发展改革委有关负责同志就《碳达峰碳中和综合评价考核办法》答记者问","https://www.ditan.com/news/hot/101235.html"
"其他/待人工判断","中新经纬","2","hot","2026年政府工作报告提及未来能源，氢能受关注","https://www.ditan.com/news/hot/11395.html"
"其他/待人工判断","中新社","2","hot|interview","解振华披露气候谈判进展：“我感到最困难的就是这次COP28”","https://www.ditan.com/news/interview/729.html"
"中央部委/国务院/监管","住建部","2","hot","两部门联合印发进一步支持城市更新行动的通知","https://www.ditan.com/news/hot/10222.html"
"公众号/自媒体/个人号","筑文说易公众号","2","hot","中央空调冷却水，为何设定为出水37℃进水32℃，过高过低有什么影响","https://www.ditan.com/news/hot/6463.html"
"中央部委/国务院/监管","自然资源部","2","hot","自然资源部:五年内80%中型矿山要达到绿色矿山标准","https://www.ditan.com/news/hot/538.html"
"其他/待人工判断","CLEANdata","2","hot","荷兰：灵活利用为减少电网阻塞带来更多可能，优先考虑社会功能项目","https://www.ditan.com/news/hot/3890.html"
"其他/待人工判断","IT之家","2","hot","欧盟对比亚迪、吉利、上汽反补贴调查进展：1-2月实地核查","https://www.ditan.com/news/hot/1124.html"
"其他/待人工判断","rfi","2","hot","世界银行：改变农粮生产方式 6年可减近1/3碳排","https://www.ditan.com/news/hot/3871.html"
"企业/项目公司","“科技创新”绘就中国式现代化图景 中国科技第一展——高交会11月深圳举行","1","hot","“科技创新”绘就中国式现代化图景 中国科技第一展——高交会11月深圳举行","https://www.ditan.com/news/hot/5215.html"
"其他/待人工判断","《巴黎协定》全文","1","hot","《巴黎协定》全文","https://www.ditan.com/news/hot/6691.html"
"其他/待人工判断","《风能》","1","hot","湄洲岛加紧建设100%使用绿电的“零碳岛”","https://www.ditan.com/news/hot/5170.html"
"其他/待人工判断","《学习时报》","1","hot","国家能源局局长王宏志：大力推动我国新能源高质量发展","https://www.ditan.com/news/hot/8479.html"
"央国企/能源集团/电网","《中国石油企业》2025年第9期","1","interview","王能全：中国能源三大热点的域外视角及思考","https://www.ditan.com/news/interview/8708.html"
"会议/活动/展会","2024第3届海南国际电子商务博览会暨海南国际跨境电商贸易展览会邀 请 函","1","hot","2024第3届海南国际电子商务博览会暨海南国际跨境电商贸易展览会邀 请 函","https://www.ditan.com/news/hot/5502.html"
"会议/活动/展会","2024年海南跨博会暨海南国际光储充产业博览会","1","hot","2024年海南跨博会暨海南国际光储充产业博览会","https://www.ditan.com/news/hot/5324.html"
"会议/活动/展会","2024深圳国际生态环境监测产业博览会","1","hot","2024第二届深圳国际生态环境监测产业博览会 暨第二届生态环境智慧监测创新应用专题论坛","https://www.ditan.com/news/hot/3642.html"
"企业/项目公司","2024中国（宁波）智慧能源产业博览会邀请函","1","hot","2024中国（宁波）智慧能源产业博览会邀请函","https://www.ditan.com/news/hot/4597.html"
"会议/活动/展会","2025亚洲供热展 2025第20届亚洲供热暖通、热水、烘干、干燥及热泵产业博览会","1","hot","2025亚洲供热展 2025第20届亚洲供热暖通、热水、烘干、干燥及热泵产业博览会","https://www.ditan.com/news/hot/5015.html"
"企业/项目公司","2025中国国际电力产业博览会暨绿色能源装备博览会","1","hot","2025中国国际电力产业博览会暨绿色能源装备博览会","https://www.ditan.com/news/hot/5676.html"
"其他/待人工判断","3060碳达峰碳中和","1","hot","国家能源局:抽蓄、核电、气电暂不核发绿证!附 新绿证全面解读!","https://www.ditan.com/news/hot/645.html"
"其他/待人工判断","3S中际联合","1","hot","5300米！3S Lift齿条升降机联运助力全球海拔最高风电项目","https://www.ditan.com/news/hot/4716.html"
"地方政府/地方主管部门","9.25-2025粤港澳大湾区智慧停车及超级充电桩展览会","1","hot","9.25-2025粤港澳大湾区智慧停车及超级充电桩展览会","https://www.ditan.com/news/hot/5586.html"
"交易/招标/采购平台","阿拉善公共资源交易网","1","bidding","6000万！内蒙古阿拉善高新技术开发区敖伦布拉格产业园区污水处理厂(1000吨/日)新建项目招标！","https://www.ditan.com/news/bidding/4819.html"
"地方政府/地方主管部门","阿拉善盟能源局","1","hot","内蒙古：国家重大项目范围内光伏项目，可以占用生态保护红线","https://www.ditan.com/news/hot/5717.html"
"其他/待人工判断","阿勒泰新闻网","1","hot","全球首个二代技术直接液化煤制油项目在中国新疆开建","https://www.ditan.com/news/hot/3514.html"
"地方政府/地方主管部门","安徽电力交易中心","1","hot","安徽征求电力现货市场三项交易结算细则意见","https://www.ditan.com/news/hot/10180.html"
"中央部委/国务院/监管","安徽省发展和改革委员会","1","hot","安徽公示第二批省级零碳园区及试点名单","https://www.ditan.com/news/hot/9561.html"
"地方政府/地方主管部门","安徽省工业和信息化厅","1","hot","安徽省2025年第二批首台套重大技术装备申报评定工作启动","https://www.ditan.com/news/hot/8674.html"
"中央部委/国务院/监管","安徽省国资委","1","hot","安徽省能源集团以能源项目合作深度融入长三角一体化发展","https://www.ditan.com/news/hot/8281.html"
"地方政府/地方主管部门","安徽省人民政府","1","hot","《安徽省空气质量持续改善行动方案》发布","https://www.ditan.com/news/hot/4698.html"
"地方政府/地方主管部门","安徽省生态环境厅","1","hot","安徽：关于加快推进玻璃等行业炉窑清洁能源替代工作的通知（征求意见稿）","https://www.ditan.com/news/hot/5438.html"
"地方政府/地方主管部门","安徽省住房城乡建设厅","1","hot","《安徽省加快推动建筑领域节能降碳实施方案》印发","https://www.ditan.com/news/hot/5911.html"
"地方政府/地方主管部门","安庆市公共资源交易中心","1","hot","运营期8年！安徽怀宁县农产品精深加工园区暨产城一体化(一期)污水处理厂及预处理站建设及运营项目中标候选人公示！","https://www.ditan.com/news/hot/3752.html"
"交易/招标/采购平台","鞍钢智慧招投标平台","1","bidding","朝阳钢铁炼铁厂烧结机头电除尘器改造总承包工程招标","https://www.ditan.com/news/bidding/3219.html"
"地方政府/地方主管部门","巴中市巴州区人民政府","1","hot","四川巴中市巴州区碳达峰实施方案：探索采用分布式储能、“光伏+储能”等能源供应模式","https://www.ditan.com/news/hot/4782.html"
"地方政府/地方主管部门","巴中市人民政府","1","hot","四川巴中：到2030年基本建成源网荷储协同互动的智慧化配电网","https://www.ditan.com/news/hot/3631.html"
"其他/待人工判断","拜登拨款63亿美元推进重工业碳中和","1","hot","拜登拨款63亿美元推进重工业碳中和","https://www.ditan.com/news/hot/3421.html"
"地方政府/地方主管部门","蚌埠市公共资源交易中心","1","bidding","2.8亿！安徽蚌埠市淮上区吴小街污水处理厂（3万吨每日）及配套管网EPCO项目招标！","https://www.ditan.com/news/bidding/3749.html"
"其他/待人工判断","保时捷","1","hot","保时捷收购 V4Drive，发力高性能电池生产","https://www.ditan.com/news/hot/7090.html"
"企业/项目公司","北方清洁能源博览会","1","themes","2024北方清洁能源博览会 暨能源装备创新成果展","https://www.ditan.com/news/themes/4200.html"
"地方政府/地方主管部门","北海市人民政府","1","hot","广西北海：落实峰谷分时、高耗能行业阶梯电价等电价政策 强化价格政策与环保政策协同","https://www.ditan.com/news/hot/5483.html"
"行业媒体/垂直资讯","北极星电池网","1","hot","美国与印度签署合作协议 加强电池材料供应链、满足储能需求","https://www.ditan.com/news/hot/5673.html"
"行业媒体/垂直资讯","北极星电力软件网","1","hot","我国首个自然资源行业碳计量中心揭牌","https://www.ditan.com/news/hot/3716.html"
"行业媒体/垂直资讯","北极星固废网","1","hot","总投资24.9亿！12万吨/年废旧锂电池资源化综合利用项目投资协议拟签订","https://www.ditan.com/news/hot/4163.html"
"行业媒体/垂直资讯","北极星能源网","1","hot","国家统计局：2025年2月下旬液化天然气（LNG）4472.2元/吨 比上期上涨4.6%","https://www.ditan.com/news/hot/7021.html"
"行业媒体/垂直资讯","​北极星售电网","1","hot","酒泉市生态环境局发布 2025 年美丽酒泉建设进展，绿色发展成果显著","https://www.ditan.com/news/hot/6862.html"
"行业媒体/垂直资讯","北极星太阳能光伏网（翻译）","1","hot","直供美国！5GW电池及组件投产","https://www.ditan.com/news/hot/6117.html"
"行业媒体/垂直资讯","北极星太阳能光伏网翻译","1","hot","OPIS：全球硅片价格稳定","https://www.ditan.com/news/hot/6206.html"
"行业媒体/垂直资讯","北极星碳管家","1","bidding","厦门市公安局集美分局能源托管招标公告","https://www.ditan.com/news/bidding/10996.html"
"地方政府/地方主管部门","北京发改委","1","hot","两项储能技术列入《北京市绿色低碳先进技术推荐目录（2024年版）》","https://www.ditan.com/news/hot/5485.html"
"地方政府/地方主管部门","北京经济技术开发区","1","hot","北京经开区发布污水处理项目补贴标准征求意见稿，完善特许经营模式","https://www.ditan.com/news/hot/6777.html"
"地方政府/地方主管部门","北京经济技术开发区管理委员会","1","hot","北京经开区绿碳新政落地 赋能新质生产力含绿量","https://www.ditan.com/news/hot/9218.html"
"其他/待人工判断","北京绿色交易网","1","hot","首创“新品替代率”概念 互联网闲置交易及回收两项减碳团体标准发布","https://www.ditan.com/news/hot/41.html"
"其他/待人工判断","北京青年报记者","1","hot","八部委印发文件，发挥检察公益诉讼作用推进快递包装绿色转型","https://www.ditan.com/news/hot/838.html"
"其他/待人工判断","北京日报","1","hot","激发市场主体绿色发展内生动力 2027年力争7成在京上市公司披露环境社会治理信息","https://www.ditan.com/news/hot/1739.html"
"其他/待人工判断","北京日报客户端","1","hot","外交部：中国是全球能源清洁转型的实干家","https://www.ditan.com/news/hot/1247.html"
"其他/待人工判断","北京生态环境","1","hot","减污降碳有迹可循 北京亦庄绿色出圈","https://www.ditan.com/news/hot/8064.html"
"中央部委/国务院/监管","北京市朝阳区发展和改革委员会","1","hot","北京市朝阳区印发《朝阳区节能减碳专项资金管理办法》","https://www.ditan.com/news/hot/4353.html"
"地方政府/地方主管部门","北京市城市管理委员会","1","hot","《北京市氢燃料电池汽车车用加氢站建设审批暂行办法》印发","https://www.ditan.com/news/hot/4945.html"
"地方政府/地方主管部门","北京市发改委发","1","hot","北京征集新能源供热项目投资支持通知","https://www.ditan.com/news/hot/11464.html"
"地方政府/地方主管部门","北京市发展改革委","1","hot","北京市发布2025年与2026年国民经济社会发展计划报告","https://www.ditan.com/news/hot/10631.html"
"地方政府/地方主管部门","北京市丰台区发展改革委","1","hot","北京市公开征集新能源产业项目！涉及太阳能、智能电网、储能等领域！","https://www.ditan.com/news/hot/5423.html"
"地方政府/地方主管部门","北京市交通委员会","1","hot","北京：氢能载货汽车非早晚高峰可进五环","https://www.ditan.com/news/hot/5967.html"
"地方政府/地方主管部门","北京市可再生能源开发利用条例实施方案：鼓励和支持开展跨区域绿电直接交易","1","hot","北京市可再生能源开发利用条例实施方案：鼓励和支持开展跨区域绿电直接交易","https://www.ditan.com/news/hot/8141.html"
"地方政府/地方主管部门","北京市门头沟区科学技术委员会","1","hot","北京市门头沟区：支持相关企业依托分布式储能上网促进新型储能实现商业化、规模化发展","https://www.ditan.com/news/hot/5827.html"
"地方政府/地方主管部门","北京市人大常委会","1","hot","北京出台《可再生能源开发利用条例》，5 月 1 日起施行","https://www.ditan.com/news/hot/7247.html"
"地方政府/地方主管部门","北京市人民政府办公厅","1","hot","北京发布 2025 年污染防治攻坚战行动计划，涵盖五大行动 108 项措施","https://www.ditan.com/news/hot/6810.html"
"地方政府/地方主管部门","北京市政府","1","hot","北京 “十五五” 规划建议出炉！深化 “0.1 微克” 攻坚 建设全域 “无废城市”","https://www.ditan.com/news/hot/9159.html"
"地方政府/地方主管部门","北京延庆区政府","1","hot","北京首个100%绿电示范园区有望明年建成！","https://www.ditan.com/news/hot/3796.html"
"其他/待人工判断","贝壳财经","1","hot","2024政府工作报告释放的十大“双碳”信号","https://www.ditan.com/news/hot/1597.html"
"地方政府/地方主管部门","滨州市公共资源交易中心","1","bidding","1.858元/Wh！山东滨州200MW/400MWh独立储能电站项目EPC+监理招标","https://www.ditan.com/news/bidding/3152.html"
"地方政府/地方主管部门","滨州市人民政府","1","hot","山东滨州：鼓励建设用户侧储能项目、调频储能项目 2025年底储能规模达到60万千瓦以上","https://www.ditan.com/news/hot/5622.html"
"地方政府/地方主管部门","兵团发展改革委","1","hot","新疆兵团：4个光伏项目被移除市场化并网清单！","https://www.ditan.com/news/hot/5695.html"
"地方政府/地方主管部门","亳州市人民政府","1","hot","安徽亳州：探索建立基于污染物排放控制水平的差别化电价政策","https://www.ditan.com/news/hot/4377.html"
"行业媒体/垂直资讯","不断突破，第三届EESA储能展圆满收官！2025再相聚！","1","hot","不断突破，第三届EESA储能展圆满收官！2025再相聚！","https://www.ditan.com/news/hot/5326.html"
"交易/招标/采购平台","采购招投标服务平台","1","bidding","总投资5.5亿！山西100MW混合储能电站EPC公开招标","https://www.ditan.com/news/bidding/8819.html"
"其他/待人工判断","采招网","1","bidding","24万标方！这一绿电制氢项目招标！","https://www.ditan.com/news/bidding/7500.html"
"地方政府/地方主管部门","常熟市人民政府","1","hot","节能减排落地见效！常熟海虞镇化工企业领跑绿色转型案例","https://www.ditan.com/news/hot/8283.html"
"地方政府/地方主管部门","常州市武进区人民政府","1","hot","常州市武进区：高标准推进近零碳园区建设","https://www.ditan.com/news/hot/8168.html"
"地方政府/地方主管部门","常州市政府办公室","1","hot","江苏常州：到2027年实施2个以上废旧动力电池梯次利用、回收利用项目","https://www.ditan.com/news/hot/5046.html"
"其他/待人工判断","厂务技术专栏","1","themes","各种能耗怎么换算，看完这篇你就知晓了！","https://www.ditan.com/news/themes/6735.html"
"地方政府/地方主管部门","潮州市人民政府","1","hot","广东潮州发布《推进分布式光伏高质量发展实施方案（2024-2030年）》","https://www.ditan.com/news/hot/5267.html"
"企业/项目公司","辰于公司","1","hot","垃圾焚烧厂设备管理：难题与精益之道","https://www.ditan.com/news/hot/7005.html"
"其他/待人工判断","成都日报","1","hot","《成都市碳达峰实施方案》印发","https://www.ditan.com/news/hot/3417.html"
"其他/待人工判断","成都商报红星新闻","1","hot","为了降低碳排放，巴黎奥运村将不安装空调","https://www.ditan.com/news/hot/1496.html"
"地方政府/地方主管部门","成都市财政","1","hot","成都财政局：重点支持新型储能产业迭代升级，深化示范应用，加强新型电力系统建设","https://www.ditan.com/news/hot/5876.html"
"地方政府/地方主管部门","成都市经济和信息化局","1","hot","成都发布 2024 年迎峰度夏电力供应保障奖补通知","https://www.ditan.com/news/hot/7079.html"
"地方政府/地方主管部门","成都市经信网","1","hot","成都：2024年新增推广500辆氢能商用车","https://www.ditan.com/news/hot/5282.html"
"地方政府/地方主管部门","成都市人民政府","1","hot","四川成都：加快农村电网改造升级和隐患排查治理","https://www.ditan.com/news/hot/7719.html"
"企业/项目公司","重庆交通开投集团","1","hot","重庆市公共交通领域完成首笔减排碳交易 成交金额超600万元","https://www.ditan.com/news/hot/1686.html"
"地方政府/地方主管部门","重庆经信委","1","hot","重庆开展“工业绿效贷”助推制造业绿色低碳转型","https://www.ditan.com/news/hot/8716.html"
"中央部委/国务院/监管","重庆市发展和改革委员会","1","hot","《重庆市规范推进政府和社会资本合作新机制实施方案（试行）》印发","https://www.ditan.com/news/hot/5668.html"
"地方政府/地方主管部门","重庆市公共资源交易网","1","bidding","总投资近1.5亿！西部（重庆）科学城九龙坡片区水系综合治理项目（一期) ——A64-6／04地块污水处理厂EPC+O项目招标！","https://www.ditan.com/news/bidding/3479.html"
"地方政府/地方主管部门","重庆市经信委","1","hot","重庆发布加氢站规划 2035 年累计建成 72 座","https://www.ditan.com/news/hot/9412.html"
"地方政府/地方主管部门","重庆市南川区人民政府","1","hot","重庆市南川区：聚焦新型储能实施一批科技计划项目，每个项目给予10—100万元的补助","https://www.ditan.com/news/hot/5677.html"
"地方政府/地方主管部门","重庆市荣昌区发展和改革委","1","hot","重庆荣昌区拟推进工业园区用户侧屋顶分布式光伏开发试点工作","https://www.ditan.com/news/hot/5543.html"
"地方政府/地方主管部门","重庆市潼南区人民政府","1","hot","重庆潼南区农村生活污水治理（管控）方案征求意见","https://www.ditan.com/news/hot/6192.html"
"地方政府/地方主管部门","重庆市渝中区人民政府","1","hot","重庆渝中区：推动重庆企业赴新疆投资算力与绿电项目","https://www.ditan.com/news/hot/8307.html"
"企业/项目公司","重庆水务环境集团","1","hot","重庆水务环境集团 2023 ESG 报告：多维度推进可持续发展","https://www.ditan.com/news/hot/6422.html"
"地方政府/地方主管部门","崇明区人民政府","1","hot","《美丽崇明建设三年行动计划（2024—2026 年）》为打造美丽上海崇明样板绘蓝图","https://www.ditan.com/news/hot/6703.html"
"行业媒体/垂直资讯","储能热榜","1","hot","习近平主席出访欧洲，CATL、天合、远景、亿纬等储能企业老板随行！","https://www.ditan.com/news/hot/6203.html"
"行业媒体/垂直资讯","储能头条","1","hot","四川 2025 年1月大工业尖峰电价暂停，分时电价机制将调整","https://www.ditan.com/news/hot/6542.html"
"地方政府/地方主管部门","楚雄州人民政府","1","hot","云南楚雄州：探索绿色金融实践 统筹对绿色发展和低碳转型的支持","https://www.ditan.com/news/hot/8067.html"
"其他/待人工判断","大理州政府","1","hot","云南大理：2024年力争新开工光伏项目1GW 新增并网1.4GW","https://www.ditan.com/news/hot/3589.html"
"其他/待人工判断","大连发布","1","hot","辽宁大连审议通过《大连市氢能产业发展规划（2024—2035年）》","https://www.ditan.com/news/hot/5276.html"
"地方政府/地方主管部门","大连市发改委","1","hot","最高2000万元！辽宁大连发布氢能产业专项资金管理办法","https://www.ditan.com/news/hot/5584.html"
"央国企/能源集团/电网","大唐电子商务平台","1","bidding","1400万 大唐南京环保科技有限责任公司再生催化剂招标中标候选人公示","https://www.ditan.com/news/bidding/3159.html"
"其他/待人工判断","大洋网","1","hot","欧盟27国代表一致支持《人工智能法案》文本","https://www.ditan.com/news/hot/1350.html"
"其他/待人工判断","大众网","1","hot","全国首个零碳港口集团 山东渤海湾港创标杆","https://www.ditan.com/news/hot/9618.html"
"会议/活动/展会","倒计时10天 | NEAS CHINA 2024最全展商阵容+论坛合集重磅揭幕，建议收藏→","1","hot","倒计时10天 | NEAS CHINA 2024最全展商阵容+论坛合集重磅揭幕，建议收藏→","https://www.ditan.com/news/hot/4712.html"
"地方政府/地方主管部门","倒计时9天 | 聚“链”成势，“圳”当其时 ！NEAS CHINA 2024大湾区展精彩亮点抢先看！","1","hot","倒计时9天 | 聚“链”成势，“圳”当其时 ！NEAS CHINA 2024大湾区展精彩亮点抢先看！","https://www.ditan.com/news/hot/6159.html"
"地方政府/地方主管部门","德阳市生态环境局","1","hot","四川德阳：到2025年清洁能源装机结构提升至70%以上","https://www.ditan.com/news/hot/5547.html"
"会议/活动/展会","第17届广州住博会将升级为世界住博会，2025展位预定火热开启","1","hot","第17届广州住博会将升级为世界住博会，2025展位预定火热开启","https://www.ditan.com/news/hot/5889.html"
"企业/项目公司","第二十六届高交会暨绿色能源装备及新型电力设备展览会抢占新商机","1","hot","第二十六届高交会暨绿色能源装备及新型电力设备展览会抢占新商机","https://www.ditan.com/news/hot/5082.html"
"行业媒体/垂直资讯","第三届 EESA 储能","1","hot","第三届 EESA 储能","https://www.ditan.com/news/hot/5180.html"
"行业媒体/垂直资讯","第三届EESA储能展即将开幕，议程干货满满、嘉宾阵容强大，速来围观！","1","hot","第三届EESA储能展即将开幕，议程干货满满、嘉宾阵容强大，速来围观！","https://www.ditan.com/news/hot/5083.html"
"地方政府/地方主管部门","第四师·可克达拉市","1","bidding","新疆四师可克达拉市300MW/600MWh储能项目招标","https://www.ditan.com/news/bidding/11588.html"
"其他/待人工判断","电池网","1","hot","52亿美元！Northvolt加拿大电池工厂或将延迟到2028年投产","https://www.ditan.com/news/hot/5278.html"
"其他/待人工判断","电动知家","1","hot","突发！特斯拉将停产！","https://www.ditan.com/news/hot/6671.html"
"其他/待人工判断","电力法律观察","1","hot","对《能源法》（草案二审稿）的几点修改建议","https://www.ditan.com/news/hot/5653.html"
"企业/项目公司","电力能源互联网","1","hot","宝丰能源：爆炸事故2人死亡，4人烧伤。八个月内三起安全事故，问题到底出在哪里？为什么事故不断？谁来负责？","https://www.ditan.com/news/hot/3682.html"
"其他/待人工判断","电线电缆网","1","hot","200台10MW风机！内蒙古两大风电项目开工","https://www.ditan.com/news/hot/3483.html"
"地方政府/地方主管部门","东北能源监管局","1","hot","东北能源监管局：吉林省电力现货市场计划于9月启动连续结算试运行","https://www.ditan.com/news/hot/8145.html"
"企业/项目公司","东驰能源","1","hot","东驰能源固态电池产品下线！与四家企业签署合作！","https://www.ditan.com/news/hot/4140.html"
