"category","source","count","channels","example_title","example_url"
"其他/待人工判断","企查查","1","hot","注资1亿 央企子公司成立动力电池回收企业","https://www.ditan.com/news/hot/1702.html"
"其他/待人工判断","起点锂电","1","hot","大圆柱电池：全面量产时代将至，多领域应用迎新潮","https://www.ditan.com/news/hot/6382.html"
"其他/待人工判断","气候变化与规则","1","hot","欧盟已正式通过立法，从2026年9月起禁止基于碳抵消的“碳中和”声明","https://www.ditan.com/news/hot/1634.html"
"企业/项目公司","千瓦科技官网","1","hot","世界地球日|千瓦科技携旗下低碳网亮相海湾低碳发展促进大会","https://www.ditan.com/news/hot/3707.html"
"中央部委/国务院/监管","黔西南州发展和改革委员会","1","hot","黔西南州 2025 年经济社会发展计划重点发布","https://www.ditan.com/news/hot/7056.html"
"地方政府/地方主管部门","黔西南州人民政府","1","hot","黔西南州发布气候资源保护开发办法，开启绿色发展新程","https://www.ditan.com/news/hot/6625.html"
"其他/待人工判断","秦山核电","1","hot","寒潮来袭！我国南方地区首个核能供热项目第四个供暖季即将开启","https://www.ditan.com/news/hot/6187.html"
"地方政府/地方主管部门","青岛市工业和信息化局","1","hot","《青岛市工业领域碳达峰工作方案》发布","https://www.ditan.com/news/hot/5283.html"
"地方政府/地方主管部门","青岛市公共资源交易电子服务系统","1","bidding","总投资13.5亿！青岛融合零碳智慧运营产业园项目工程总承包招标！","https://www.ditan.com/news/bidding/113.html"
"地方政府/地方主管部门","青岛市住房和城乡建设局","1","hot","2024年山东省绿色建筑与建筑节能试点申报开启","https://www.ditan.com/news/hot/5368.html"
"其他/待人工判断","青岛西海岸发布","1","hot","我国首个工厂化海水直接制氢科研项目在青岛建成试运行","https://www.ditan.com/news/hot/6342.html"
"地方政府/地方主管部门","青海电力交易中心","1","hot","青海电力现货市场第三次结算试运行情况通报：实时市场日均出清电量1.5613亿千瓦时","https://www.ditan.com/news/hot/7972.html"
"地方政府/地方主管部门","青海省发展改革委","1","hot","青海省发挥清洁能源资源优势 推动实现绿电价值转化","https://www.ditan.com/news/hot/8357.html"
"地方政府/地方主管部门","青海省科学技术厅","1","hot","青海：开展绿电溯源认证、绿电交易、能源互联网等关键技术研发","https://www.ditan.com/news/hot/4775.html"
"地方政府/地方主管部门","青海省能源局","1","hot","青海省新能源项目开发建设管理办法征求意见稿发布","https://www.ditan.com/news/hot/8481.html"
"地方政府/地方主管部门","青海省商务厅","1","hot","全文 | 《青海省推进绿色低碳转型加快融入全国碳市场建设实施方案》印发","https://www.ditan.com/news/hot/8862.html"
"地方政府/地方主管部门","青海省推动工业绿色转型实施方案","1","hot","青海省推动工业绿色转型实施方案","https://www.ditan.com/news/hot/5681.html"
"中央部委/国务院/监管","青海市发展和改革委员会","1","hot","青海发改委印发绿电方案，精准助力出口企业降碳","https://www.ditan.com/news/hot/8369.html"
"协会/联盟/研究机构","清华大学能源环境经济研究所","1","hot","“酒店业绿色低碳转型案例与经验分享会”在澳门环保展举行","https://www.ditan.com/news/hot/3577.html"
"地方政府/地方主管部门","清远市政府","1","hot","广东清远发文：鼓励工业企业自建分布式光伏发电系统和新型储能设施","https://www.ditan.com/news/hot/4033.html"
"其他/待人工判断","求是网","1","hot","加快规划建设新型能源体系！习近平总书记《关于〈中共中央关于进一步全面深化改革、推进中国式现代化的决定〉的说明》","https://www.ditan.com/news/hot/4948.html"
"其他/待人工判断","全国风力发电标准化技术委员会","1","hot","三项国家级风电标准正式发布，11月1日实施！","https://www.ditan.com/news/hot/3882.html"
"其他/待人工判断","全国工商联","1","hot","2025中国民营企业500强发布报告：83%的企业推进绿色低碳转型","https://www.ditan.com/news/hot/8342.html"
"地方政府/地方主管部门","全国公共资源交易中心","1","bidding","1.1MW/2.365MWh！安徽广银铝业用户侧储能项目EPC（总承包）工程项目招标","https://www.ditan.com/news/bidding/3630.html"
"企业/项目公司","全球能源互联网发展合作组织","1","interview","辛保安与联合国副秘书长、非经委执秘加泰特举行会谈","https://www.ditan.com/news/interview/5206.html"
"企业/项目公司","全应科技","1","hot","双化协同发展推进能源资源转型升级","https://www.ditan.com/news/hot/5133.html"
"官方媒体/主流媒体","人民日报客户端","1","hot","全国首个企业电-碳-金融服务中心成立","https://www.ditan.com/news/hot/4685.html"
"地方政府/地方主管部门","人民日报客户端、新华社河北雄安新区","1","hot","3月23日习近平总书记考察河北雄安新区","https://www.ditan.com/news/hot/100605.html"
"官方媒体/主流媒体","人民网-国际频道","1","hot","联合国政府间气候变化专门委员会第60次全会在土耳其闭幕","https://www.ditan.com/news/hot/1226.html"
"中央部委/国务院/监管","人民政协报、生态环境部","1","hot","黄润秋部长署名文章：《锚定“十五五”发展目标 推动美丽中国建设取得新的重大进展》","https://www.ditan.com/news/hot/101021.html"
"其他/待人工判断","人民政协网","1","hot","全国政协委员蒋颖：加强中国绿证国际认可度","https://www.ditan.com/news/hot/3594.html"
"其他/待人工判断","日经中文网","1","hot","日本拟加价收购可弯曲光伏电池发出的电","https://www.ditan.com/news/hot/1682.html"
"地方政府/地方主管部门","融安县发展和改革局","1","hot","广西融安县发布分布式光伏并网接入红色预警公告","https://www.ditan.com/news/hot/5746.html"
"企业/项目公司","塞尔维亚与斯洛文尼亚开启核能合作探讨，能源变革可期","1","hot","塞尔维亚与斯洛文尼亚开启核能合作探讨，能源变革可期","https://www.ditan.com/news/hot/6771.html"
"企业/项目公司","赛逸（上海）会展有限公司","1","hot","2025第七届亚洲消费电子技术展","https://www.ditan.com/news/hot/6197.html"
"地方政府/地方主管部门","三明市公共资源交易网","1","bidding","福建三明市荆东污水处理厂扩建项目（工程总承包）公开招标！","https://www.ditan.com/news/bidding/3535.html"
"央国企/能源集团/电网","三峡集团","1","bidding","磷酸铁锂+钠离子！三峡能源安徽阜南39.8MW/79.6MWh储能电站二期项目EPC招标","https://www.ditan.com/news/bidding/5054.html"
"央国企/能源集团/电网","三峡建工","1","hot","青海南山口抽水蓄能电站引水系统、地下厂房主体工程正式开工","https://www.ditan.com/news/hot/5203.html"
"其他/待人工判断","沙漠掘进","1","hot","COP28:为何中国无法承诺？","https://www.ditan.com/news/hot/870.html"
"地方政府/地方主管部门","厦门发改委","1","hot","厦门发布氢能产业新政 最高补贴 3000 万","https://www.ditan.com/news/hot/9625.html"
"地方政府/地方主管部门","厦门市人民政府","1","hot","《厦门市海绵城市建设管理规定》发布！","https://www.ditan.com/news/hot/3863.html"
"地方政府/地方主管部门","山东能监办","1","hot","山东发布两版电力管理实施细则修订稿 2026 年施行","https://www.ditan.com/news/hot/9731.html"
"地方政府/地方主管部门","山东省工业和信息化厅","1","hot","山东：建设一批“超级能效”和“零碳”化工企业","https://www.ditan.com/news/hot/10792.html"
"地方政府/地方主管部门","山东省人民政府新闻办公室","1","hot","权威发布丨2030年超1亿平方米！山东将建成国家地热能高质量发展示范区","https://www.ditan.com/news/hot/482.html"
"地方政府/地方主管部门","山东省统计局","1","hot","2025年上半年山东省经济运行情况解读：绿色能源保持快速发展势头","https://www.ditan.com/news/hot/8036.html"
"地方政府/地方主管部门","山西省发改委","1","hot","《山西省数据工作管理办法》征求意见","https://www.ditan.com/news/hot/3800.html"
"地方政府/地方主管部门","山西省发展改革委","1","hot","山西零碳（低碳）、绿电园区试点建设专项资金管理办法征求意见发布","https://www.ditan.com/news/hot/8656.html"
"地方政府/地方主管部门","山西省工业和信息化厅","1","hot","山西省重点产业链2025年第二批链核企业名单公示啦","https://www.ditan.com/news/hot/10122.html"
"地方政府/地方主管部门","山西省市场监督管理局","1","themes","山西地方标准《重点行业企业碳排放管理体系评价通则》印发！","https://www.ditan.com/news/themes/1436.html"
"地方政府/地方主管部门","山西省住房和城乡建设厅","1","hot","山西住建厅征求建筑固废碳核算标准意见","https://www.ditan.com/news/hot/10327.html"
"交易/招标/采购平台","山西新点招投标交易平台","1","bidding","格盟宜和风光制氢一期 制氢设备二次招标公告","https://www.ditan.com/news/bidding/9219.html"
"交易/招标/采购平台","山西招标采购服务平台","1","bidding","山西吕梁 600MWh 共享储能项目招标 总投资 4.5 亿元","https://www.ditan.com/news/bidding/9306.html"
"其他/待人工判断","陕工信发〔2024〕104号","1","hot","陕西省第一批工业领域碳达峰试点项目名单","https://www.ditan.com/news/hot/3663.html"
"企业/项目公司","陕煤集团","1","hot","年发电量 8640万度！陕煤集团陕焦公司干熄焦余热发电项目正式投产运行","https://www.ditan.com/news/hot/7726.html"
"地方政府/地方主管部门","陕西电力交易中心","1","hot","11 月 24 日起实施！陕西补充修订保底售电机制补充条款","https://www.ditan.com/news/hot/9148.html"
"会议/活动/展会","陕西发展改革","1","hot","11.212亿元！国家发展改革委下达陕西省污染治理和节能降碳资金！","https://www.ditan.com/news/hot/5121.html"
"地方政府/地方主管部门","陕西发展改革委","1","hot","《关于调整陕西电网分时电价政策有关事项的通知》政策解读","https://www.ditan.com/news/hot/7854.html"
"地方政府/地方主管部门","陕西省发改委","1","hot","2025年5个完成数字化工业园区！陕西千亿级钛及钛合金产业创新集群行动计划发布","https://www.ditan.com/news/hot/3551.html"
"地方政府/地方主管部门","陕西省人民政府","1","hot","陕西：支持钢铁等行业民营企业与新能源企业签订中长期绿电购售协议","https://www.ditan.com/news/hot/8251.html"
"地方政府/地方主管部门","汕头市发展和改革局","1","hot","广东汕头发改局出台《汕头市推动新型储能产业高质量发展行动方案（2024—2026年）》","https://www.ditan.com/news/hot/5791.html"
"其他/待人工判断","商洛日报","1","hot","陕西山阳全钒液流电池生产线冲刺攻坚 抢占储能新高地","https://www.ditan.com/news/hot/100750.html"
"其他/待人工判断","上观","1","hot","今年全国将新增服务区充电桩3000个 充电停车位5000个","https://www.ditan.com/news/hot/1493.html"
"其他/待人工判断","上海宝山","1","hot","上海宝山区开展首届职工绿色低碳技术创新竞赛40项创新成果引领转型，100余个标杆场景全国首发","https://www.ditan.com/news/hot/7359.html"
"其他/待人工判断","上海成套院","1","hot","国家电投上海成套院与中煤电力签订战略合作框架协议","https://www.ditan.com/news/hot/3797.html"
"其他/待人工判断","上海电气","1","hot","上海电气与法国电力集团共商绿色能源合作新机遇","https://www.ditan.com/news/hot/7837.html"
"行业媒体/垂直资讯","上海电气风电集团","1","hot","智领风电AI诊断！电气风电牵头一国家重点研发计划项目","https://www.ditan.com/news/hot/7814.html"
"会议/活动/展会","上海发展改革","1","hot","率先出台绿色转型地方立法，《上海市发展方式绿色转型促进条例》发布","https://www.ditan.com/news/hot/988.html"
"地方政府/地方主管部门","上海奉贤区人民政府","1","hot","上海奉贤区：强化政策供给 推动太阳能电池等绿色新能源细分赛道加快发展","https://www.ditan.com/news/hot/5692.html"
"其他/待人工判断","上海海湾国家森林公园","1","hot","节能宣传周 | 畅游海湾，节能减排","https://www.ditan.com/news/hot/3937.html"
"其他/待人工判断","上海环境","1","hot","首个上海温室气体自愿减排交易产品SHCERCIR1将上线运行！","https://www.ditan.com/news/hot/5304.html"
"协会/联盟/研究机构","上海交通大学碳中和发展研究院","1","hot","2023年度碳中和与应对气候变化领域最具影响力“十大事件”","https://www.ditan.com/news/hot/1001.html"
"企业/项目公司","上海决策者经济顾问股份有限公司","1","hot","动力澎湃，潮涌浦江！第十二届航空动力和燃气轮机聚焦大会暨展览会即将璀璨启幕","https://www.ditan.com/news/hot/7491.html"
"其他/待人工判断","上海申能","1","hot","上海10万吨级绿色甲醇项目合作签约仪式举行！","https://www.ditan.com/news/hot/5284.html"
"地方政府/地方主管部门","上海市海洋局","1","hot","上海：打造大规模海上光伏基地 推动东海大桥等海上光伏项目建设及并网投运","https://www.ditan.com/news/hot/7529.html"
"地方政府/地方主管部门","上海市虹口区人民政府","1","hot","给予补贴800元/千瓦！上海虹口区开展2024年分布式光伏项目补贴申报工作","https://www.ditan.com/news/hot/5441.html"
"地方政府/地方主管部门","上海市黄浦区人民政府","1","hot","上海黄浦区：鼓励重点用能和排放单位参与建筑光伏一体化建设","https://www.ditan.com/news/hot/5625.html"
"地方政府/地方主管部门","上海市交通委员会","1","hot","上海公开征求公共充电网络建设指引意见，划分三类区域差异化建设","https://www.ditan.com/news/hot/7227.html"
"地方政府/地方主管部门","上海市金山区人民政府","1","themes","上海市金山区2024年碳达峰碳中和及节能减排重点工作安排发布","https://www.ditan.com/news/themes/4441.html"
"地方政府/地方主管部门","上海市科学技术委员会","1","hot","关于组织申报国家重点研发计划颠覆性技术创新重点专项能源低碳联合项目2025年度煤炭清洁高效利用项目的通知","https://www.ditan.com/news/hot/8184.html"
"地方政府/地方主管部门","上海市浦东新区发展和改革委","1","hot","最高0.95元/瓦！上海浦东新区启动2024第二批光伏发电专项资金项目申报","https://www.ditan.com/news/hot/5749.html"
"中央部委/国务院/监管","上海市浦东新区发展和改革委员会","1","hot","鼓励储能！最高补贴500万！上海浦东节能低碳专项资金管理办法征意见","https://www.ditan.com/news/hot/5960.html"
"地方政府/地方主管部门","上海市普陀区人民政府","1","hot","上海普陀：确保小区充电电价按照居民电价执行 引导企业合理确定充电服务价格标准","https://www.ditan.com/news/hot/5544.html"
"地方政府/地方主管部门","上海市青浦区人民政府","1","hot","青浦区发力城市管理精细化，未来三年绘就发展新蓝图","https://www.ditan.com/news/hot/6608.html"
"地方政府/地方主管部门","上海市人大常委会","1","hot","《上海市发展方式绿色转型促进条例（草案）》（征求意见稿）","https://www.ditan.com/news/hot/637.html"
"地方政府/地方主管部门","​上海市生态环境局","1","hot","《长江三角洲区域生态环境行政处罚裁量规则》公开征求意见","https://www.ditan.com/news/hot/69.html"
"地方政府/地方主管部门","上海市水务局","1","hot","上海明确系统化全域推进海绵城市建设水务实施方案","https://www.ditan.com/news/hot/5389.html"
"地方政府/地方主管部门","上海市杨浦区人民政府","1","hot","杨浦区发布绿色低碳转型行动方案草案，征求公众意见","https://www.ditan.com/news/hot/6959.html"
"地方政府/地方主管部门","上海市住房和城乡建设管理委员会","1","hot","上海发布 2025 年海绵城市建设工作要求，明确目标举措","https://www.ditan.com/news/hot/6885.html"
"其他/待人工判断","上海有色网","1","hot","印度政府官宣4月1日起正式实施ALMM名单！组件出口量恐将萎缩！【SMM分析】","https://www.ditan.com/news/hot/3510.html"
"企业/项目公司","上海有色网信息科技股份有限公司","1","hot","天能、瑞达、理士、旭派、京九……为啥这么多铅酸厂都去越南了？","https://www.ditan.com/news/hot/8448.html"
"其他/待人工判断","上海证券报","1","hot","新版锂电池行业规范条件征求意见 产品性能要求进一步提高","https://www.ditan.com/news/hot/3907.html"
"其他/待人工判断","上海证券报·中国证券网","1","hot","证监会主席见沙特财政大臣：共推绿色经济合作","https://www.ditan.com/news/hot/4024.html"
"其他/待人工判断","上能电气","1","hot","高效履约 全球实力！上能电气助力埃及150MW/300MWh储能电站顺利并网","https://www.ditan.com/news/hot/7680.html"
"地方政府/地方主管部门","绍兴市柯桥区人民政府","1","bidding","绍兴轻纺数字贸易港零碳物流园区招标","https://www.ditan.com/news/bidding/11139.html"
"其他/待人工判断","深能北控","1","hot","国内首个“本征无储能”离网制氢系统开工！","https://www.ditan.com/news/hot/8142.html"
"企业/项目公司","深圳能源","1","bidding","新疆克拉玛依生活垃圾焚烧发电项目烟气净化系统设备采购招标","https://www.ditan.com/news/bidding/5486.html"
"其他/待人工判断","深圳商报","1","hot","深圳连续多年居全国第一","https://www.ditan.com/news/hot/626.html"
"地方政府/地方主管部门","深圳生态环境局","1","hot","深圳 5 部门印发规范 气候投融资项目库落地","https://www.ditan.com/news/hot/9451.html"
"地方政府/地方主管部门","深圳市工业和信息化局","1","hot","深圳印发计划推动AI服务器产业链高质量发展文件","https://www.ditan.com/news/hot/100684.html"
"地方政府/地方主管部门","深圳市科技创新局","1","hot","深圳市征集 2025 年度重点产业研发计划备选课题（第一批）","https://www.ditan.com/news/hot/7269.html"
"地方政府/地方主管部门","深圳市人民政府","1","hot","奖励1000万！深圳发布2026年技改绿造申报指南","https://www.ditan.com/news/hot/10278.html"
"地方政府/地方主管部门","深圳市生态环境","1","hot","深圳发布2026年度生态环境专项资金申报通知","https://www.ditan.com/news/hot/11046.html"
"地方政府/地方主管部门","深圳市生态环境局","1","hot","深圳市发布2024年度碳排放配额分配方案","https://www.ditan.com/news/hot/4947.html"
"其他/待人工判断","沈阳生态环境","1","hot","无害化处置率100%！沈阳构建城镇污泥本域化多元化处理模式","https://www.ditan.com/news/hot/7827.html"
"地方政府/地方主管部门","沈阳市工业和信息化局","1","hot","辽宁开始布局零碳工厂｜沈阳市开展“零碳” 工厂建设典型案例遴选工作","https://www.ditan.com/news/hot/3476.html"
"其他/待人工判断","生态环境","1","hot","44个！生态环境部公布第一批通过评估的清洁生产审核创新试点项目名单","https://www.ditan.com/news/hot/5064.html"
"中央部委/国务院/监管","生态环境部 交通运输部","1","hot","关于发布《温室气体自愿减排项目方法学 公路隧道照明系统节能（CCER—07—001—V01）》的通知","https://www.ditan.com/news/hot/6555.html"
"中央部委/国务院/监管","生态环境部办公厅","1","hot","关于做好2023—2025年发电行业企业温室气体排放报告管理有关工作的通知","https://www.ditan.com/news/hot/192.html"
"中央部委/国务院/监管","生态环境部环境规划院","1","hot","李强签署国务院令 公布《生态保护补偿条例》","https://www.ditan.com/news/hot/3570.html"
"其他/待人工判断","石岛湾核电","1","hot","华能石岛湾核电入列全球十大工程，彰显科技实力","https://www.ditan.com/news/hot/6406.html"
"行业媒体/垂直资讯","世纪能源网","1","hot","1月，8名能源央企主要领导人被查","https://www.ditan.com/news/hot/1391.html"
"行业媒体/垂直资讯","世纪新能源网","1","bidding","广州发展湖北洪湖钠离子储能电站50MW/100MWh项目EPC招标","https://www.ditan.com/news/bidding/3520.html"
"协会/联盟/研究机构","世界经济论坛微信公众号","1","interview","何立峰:中国将全面实施碳排放总量和强度双控制度","https://www.ditan.com/news/interview/10149.html"
"其他/待人工判断","世界农化网","1","hot","欧盟即将通过立法，″碳中和″标签时代可能提前落幕？！","https://www.ditan.com/news/hot/1261.html"
"企业/项目公司","世界政经科技论坛","1","interview","中澳合作引领低碳未来，专家共话双边可持续发展","https://www.ditan.com/news/interview/414.html"
"会议/活动/展会","世展网","1","hot","【2024.6.5-6.8】第二届上海国际碳中和博览会：“碳”寻创新科技，掘金“双碳“浪潮","https://www.ditan.com/news/hot/3148.html"
"其他/待人工判断","视知产研院","1","hot","比亚迪凭借安全性能又中全球电池储能大单","https://www.ditan.com/news/hot/4869.html"
"其他/待人工判断","首都之窗","1","hot","《北京市碳排放权交易管理办法》印发","https://www.ditan.com/news/hot/1671.html"
"企业/项目公司","首席能源观","1","interview","李健：能源央企如何发挥科技创新主体作用","https://www.ditan.com/news/interview/5308.html"
"协会/联盟/研究机构","双碳战略联盟","1","interview","王毅解读 “十五五”：以新能源替代推进降碳转型","https://www.ditan.com/news/interview/9411.html"
"其他/待人工判断","水电十六局","1","hot","中国电建丰宁 100 兆瓦牧光储氢一体化项目竣工并网","https://www.ditan.com/news/hot/6104.html"
"企业/项目公司","水务科技博览会","1","themes","观展指南丨2025深圳国际水务科技博览会11月24日开幕，观展必读","https://www.ditan.com/news/themes/8794.html"
"其他/待人工判断","硕电汇","1","hot","国家能源局发布2026年2月绿证核发与交易数据","https://www.ditan.com/news/hot/100602.html"
"地方政府/地方主管部门","四川技能大赛—2024年四川省工业和信息化技术技能大赛（电力监控系统网络 安全管理赛项）圆满闭幕","1","hot","四川技能大赛—2024年四川省工业和信息化技术技能大赛（电力监控系统网络 安全管理赛项）圆满闭幕","https://www.ditan.com/news/hot/5888.html"
"其他/待人工判断","四川经济和信息化厅","1","hot","四川：对实施光伏等绿色低碳制造业企业用能激励的市（州）给予奖励","https://www.ditan.com/news/hot/5690.html"
"其他/待人工判断","四川日报","1","hot","每年安排30亿元！四川加大力度支持工业领域设备升级改造","https://www.ditan.com/news/hot/5097.html"
"其他/待人工判断","四川生态环境","1","hot","四川加大绿色金融供给，助力美丽四川建设","https://www.ditan.com/news/hot/11485.html"
"地方政府/地方主管部门","四川省节能低碳协会","1","themes","2025中国碳中和技术大会在成都隆重举行，共探绿色低碳发展新路径","https://www.ditan.com/news/themes/7438.html"
"地方政府/地方主管部门","四川省商务厅","1","hot","四川：转让旧车并购买新能源乘用车新车最高补贴1.7万元","https://www.ditan.com/news/hot/5601.html"
"地方政府/地方主管部门","四川省循环经济协会","1","hot","国内首个！《零碳智慧变电站评价规范》团体标准发布","https://www.ditan.com/news/hot/7577.html"
"地方政府/地方主管部门","四川省自然资源厅","1","hot","四川省多部门联合印发重大电网项目保障机制","https://www.ditan.com/news/hot/10976.html"
"其他/待人工判断","四川在线","1","hot","1月28日国内首个水光蓄储一体化光伏项目投产","https://www.ditan.com/news/hot/10318.html"
"其他/待人工判断","搜狐","1","hot","小米集团发布气候行动白皮书：承诺2040年实现碳中和","https://www.ditan.com/news/hot/702.html"
"其他/待人工判断","搜狐网","1","hot","生物质能碳捕集与封存技术：前景与挑战并存","https://www.ditan.com/news/hot/6613.html"
"地方政府/地方主管部门","苏州市人民政府","1","hot","《国家碳达峰试点（苏州工业园区）实施方案》印发","https://www.ditan.com/news/hot/3962.html"
"行业媒体/垂直资讯","索比氢能网","1","hot","取消制氢计划！英国海上风电项目专注供电","https://www.ditan.com/news/hot/1669.html"
